{
  "schema_version": "scan.result.v1",
  "tenant_id": "tenant-local",
  "project_id": "project-dev",
  "result_id": "result_01JZ8N28ZS7FGNY7AAQH8HP17B",
  "job_id": "scan_01JZ8N0B9XCKXH0W1W9Y8P7W4E",
  "inventory_id": "6650f8cb1c5e7c6c1f93a111",
  "test_type": "bola",
  "template_id": "karaxys/bola/basic-object-id",
  "status": "failed",
  "vulnerable": true,
  "severity": "high",
  "description": "Object ID change returned another user's data.",
  "proof": "curl -v -X GET http://api.example.local/api/v1/users?id=124 -H 'Authorization: <redacted>'",
  "response": {
    "status_code": 200,
    "headers": {
      "Content-Type": ["application/json"]
    },
    "body_excerpt": "{\"id\":124,\"email\":\"other@example.com\"}",
    "body_sha256": "0123456789abcdef0123456789abcdef0123456789abcdef0123456789abcdef"
  },
  "created_at": "2026-06-16T10:05:31Z"
}
